event	date	year	speaker	position	flavor	title	abstract	hashcode
25	December 5th	2024	Alec Pollak	PhD Candidate in the Department of Literatures in English at Cornell University	a publishing	On Strike Against God: Reflecting on 1970s Feminism Today	"""Let's be reasonable. Let's demand the impossible."" These words end On Strike Against God, a slim, long-lost lesbian novel set in Ithaca New York, by feminist science-fiction author Joanna Russ. Out of print for 40 years and now, finally, available again through the Feminist Press, On Strike Against God follows Esther, a Cornell English professor, as she has her first lesbian love affair and struggles to make sense of her life anew. On Strike Against God is an artifact of 1970s feminism, in good ways and bad: it's angry, controversial, and blunt. It's uninterested in nuance. It doesn't pull punches, and it doesn't apologize. It seeks to agitate, challenge, and offend. In so many ways, it's an easy target--ripe for critique. And yet, in a post-Roe v. Wade world, and on the precipice Trump 2.0, much of the novel rings urgently--and eerily--true today. What lessons can we learn from generations of feminists past, as history's clocks turn backwards? Alec Pollak recounts the process of rescuing, editing, and republishing On Strike Against God in 2024, and considers how, in light of November's election, we might engage feminist writings of yesteryear. "	apollak
26	February 5th	2025	Jonny Robert Lawrence	Assistant Professor in the Department of Near Eastern Studies at Cornell	a medieval studies	Down Bad in Medieval Baghdad, or a Tale as Old as Time	In the early 10th century, a man called Ibn Dāwūd died from love – or, that’s what the biographers tell us, at least. Ibn Dāwūd lived and died in Baghdad, at the time one of the world’s major centres of art, culture, science, and mathematics. He was a strict jurist and legal thinker, but also a flâneur, an aesthete and a poet-author. Upon meeting a beautiful local apothecary, Muḥammad ibn Jāmiʿ (or, was it Wahb ibn Jāmiʿ? The sources aren’t sure…), he falls madly in love and the pair embark upon a sweet, seemingly reciprocal relationship. Yet, love’s course is not as easy as it may seem and all sorts of personal, social and legal problems might get in the way… with fatal consequences. In this talk, we will be meeting our medieval forebears where they are at, and exploring how their tales of overwhelming passion, death and destruction can speak to us in the contemporary world.	jlawrence
26	February 5th	2025	Stephanie Zuber	A Local Sex Therapist (LMHC, MS)	 a public health	Rethinking Sex: What We Know About the Sexual Response Cycle and How It Can Improve Your Bedroom Tonight	"Ever wondered why your body doesn’t always respond the way you expect in the bedroom? The answer lies in the science of the sexual response cycle. Join us for a brief dive into what we now know about sexual arousal, desire, and satisfaction—and how you can use this knowledge to improve your sex life tonight. You’ll learn about the revolutionary ""dual control model"" of sexual arousal, a game-changing framework that radically shifts the way we think about horniness. Whether you're looking to reignite the spark, enhance intimacy, or simply better understand your own body, this talk will offer practical insights you can start using right away!"	szuber
27	March 5th	2025	Cátia P. Dombaxe	PhD Candidate in Biomedical Engineering at Cornell University	a health sciences	Nature’s Secret to Spinal Cord Healing: What Goldfish Can Teach Us About Recovery	In the intricate world of nerve regeneration, some animals have a remarkable ability to heal what seems impossible — like goldfish, which can regenerate their spinal cords after injury. But what if we could unlock this same potential in humans? This talk dives into the fascinating science behind my research, where we use bioengineered materials to deliver nature-inspired regenerative proteins and enzymes, aiming to help damaged spinal cords recover. By blending biomaterials, neuroscience, and the wisdom of evolution, we’re exploring a future where spinal cord injuries no longer mean a lifetime of paralysis. Join me as we uncover how goldfish might hold the key to a medical breakthrough that could change lives.	cdombaxe
27	March 5th	2025	Noah Mapes	PhD Candidate in the Department of History of Art and Visual Studies at Cornell University	an art history	Materializing Alliances: How Artworks Can Act as Diplomats in Anishinaabe Politics	It is important for the field of art history to celebrate the numerous histories of aesthetics and worldviews that converge, diverge, and create the United States. This talk aims to expand the scopes of visual and material analysis by embracing Anishinaabe beliefs that recognize the ensouled animacy of animals and certain objects as non-human beings. Specifically, with the aid of Anishinaabe origin stories and principles such as mino-bimaadiziwin and biskaabiiyang, this talk shares how select artworks and objects act as political agents, entering into and influencing human and non-human compacts for the empowerment of Anishinaabe diplomacy.	nmapes
28	April 2nd	2025	Rediet Lewi	PhD Student in Anthopology at Cornell University	an anthropology	Anthropology and Fiction: Representing Distress on the Screen	Mental health has been an increasingly popular topic in our current public conversations. Even so, there continues to be contentious disagreements about how it is understood and expressed. Through a deeper look at belief systems that shape not only different cultures, but also biomedicine, I argue that knowledge about distress is not neutral. Instead, it is influenced by assumptions about nature of humanity in general but also by biased views about the nature of particular social groups. Anthropology and its ethnographic methods allow us to examine the complex layers of factors that color experiences of distress. In this talk, I ask, how do we best capture such experiences of distress? I explore the possibilities that are opened up by incorporating fiction into social science research and communication.	rlewi
28	April 2nd	2025	Aalayna R. Green	PhD Candidate in Natural Resources & the Environment	an environmentalist	Hot Girl Conservationist: How to Be a More Educated and More Caring Conservationist	What if everything you ever knew about conservation was wrong? This talk explores the histories and modern practices of conservation from a perspective that likely wasn't taught in your classroom. From human zoos to wildlife trafficking, we'll delve into the hidden underbelly of conservation science and practice. We'll also explore avenues for a more caring and just future, including how we can all take steps to become better conservationists ourselves. 	agreen
29	May 7th	2025	Francine Barchett	PhD Candidate in Natural Resources and the Environment at Cornell University	an environmentalist	Saving the Planet without Preaching to the Choir: Curiosity, Conflict, & Conservation in a Divided World	The projected future of our planet reads like a dystopian novel: melting ice sheets, silent forests, smog-choked skies, and a world increasingly at war with itself. But the question is: can we solve issues this big in a world so deeply divided? I happen to research one of the most controversial conservation topics today: hunting in Africa. I also teach a Cornell undergraduate course that encourages students to communicate environmental issues across ideological lines while stepping outside echo chambers. In a cultural moment of “I’m right, you’re wrong,” this talk won’t offer easy answers—but it might leave you just a bit more curious, courageous, and ready to find common ground where you least expect it. 	fbarch
29	May 7th	2025	Kate Donohue	Executive Director of Cinemapolis	an arts	How Movie Theaters Work and Why They Matter	How do theaters book movies? How do movie theater projectors work? What is the secret to the best popcorn in Central New York?  This talk will address burning questions about what goes on behind the scenes at a nonprofit independent movie theater. It will also use research on media and public health to illustrate why movie theaters play an essential role in building strong communities. 	kdono
30	June 4th	2025	Dr. Marianne Krasny	Director of the Cornell Civic Ecology Lab	a public health	Seed Oils, UPFs, And Carni-Bros: Is RFK Jr. Making America Healthy Again?	RFK Jr is tackling some important diet problems, like Americans’ love of ultra-processed foods (UPFs). But he is fat-shaming public officials while chowing down on French fries and a double cheeseburger with Sean Hannity on Fox TV. On his second day in office, he closed the NIH program researching how climate change is impacting our health. Is RFK Jr Making America Healthy Again? 	mkras
30	June 4th	2025	Dr. Jeff Iovannone	Social and architectural historian who specializes in conserving LGBTQ history.	a history	Conserving LGBTQ Historic Places: Firebrand Books, Lavender Hill, Stonewall	Dr. Jeff Iovannone will discuss the importance and challenges of conserving LGBTQ historic places in the face of increasing backlash through three examples: the Firebrand Books headquarters on the Ithaca Commons, the Lavender Hill commune in southern Tompkins County, and the Stonewall National Monument in Greenwich Village. 	jiov
31	August 6th	2025	Lisa Swayze	Executive Director, Buffalo Street Books/Ithaca Literary.	a literary	Why Do Indie Bookstores Even Still Exist? (& Why Should You Care)	What is an independent bookstore and what does it contribute to a community that no other business or online retailer can? Learn more through the example of Ithaca's beloved Buffalo Street Books.</br>Lisa Swayze is the executive director of Ithaca Literary Ltd (ILL), which is the home of Ithaca's nonprofit independent bookstore, Buffalo Street Books. She also serves on the board of the American Booksellers Association.  	lswa
31	August 6th	2025	Brit Johnson	PhD Candidate in Entomology at Cornell University.	a science	Role for Success: Adventures in Mosquito Evolution	Have you ever wondered why some animals live longer than others? Or why some have thousands of babies over their lifetime while others only have a few. These differences are shaped by evolution and the ways animals balance growing up, staying alive, and having babies—a concept known as life history theory. It explores how organisms invest energy into these activities and the combined strategies they use to maximize their chances of passing on genes. For those that win this evolutionary game, their legacy lives on through offspring ready to face the next round of natural selection. But for those that fall short, their lineage may persist, but with diminishing success. Mosquitoes are no exception to the rules of this game, and the choices they make will not only determine if they win or lose, but also if they spread disease along the way. Join me in exploring how mosquitoes play the game of life—and how their choices make them one of the deadliest animals on the planet.  	bjoh
32	September 3rd	2026	Manasi Anand	PhD Candidate in Natural Resources and the Environment at Cornell	an environmentalist	When Climate Solutions Become Problems: The Search for elusive 'win-wins'	When do environmental problems generate solutions? When do solutions generate new problems? Can we ever achieve true “win-win” outcomes?</br>Climate change is reshaping everything we know about how the world works. Carbon markets once promised to save the planet through the magic of market mechanisms- but like most magic tricks, the closer you look, the more complicated it gets. Too often, these schemes come at the expense of people, biodiversity, and cultural land management practices.</br>But here’s where it gets interesting: while top-down carbon programs frequently stumble over their own contradictions, something different is happening at the grassroots. What emerges when local communities chart their own pathways? Drawing on field research and real-world examples, this talk explores when environmental challenges spark genuine innovation, when well-intentioned solutions create new dilemmas, and whether those elusive “win-win-win” scenarios are possible- or if we must learn to navigate more complex trade-offs.</br>Join researcher Manasi Anand as she traces her journey through the world of forest policy and institutions—the good (yes, there is some!), the bad (plenty), and the downright ugly (buckle up).  	mana
32	September 3rd	2026	Sara Haefeli	Associate Professor of Composition and Music Studies at Ithaca College	a music history	Whose World?: Western Musical Globalism and the 1967 BBC Live Broadcast “Our World”	The 1967 BBC program "Our World" was the first live global television broadcast, connecting viewers around the world in real time. Audiences witnessed glimpses of daily life, athletic feats, moments of scientific innovation, and cultural performances—including a recording session with the Beatles. This presentation explores how the musical choices and everyday sounds in the broadcast shaped a message of modern progress, yet foregrounded elite Western perspectives. We’ll look at striking moments from the broadcast, from mariachi in Mexico to ambient computer "beats" in Australia, and reflect on what these sounds reveal about whose voices, music, and cultures made up "our world." Join me to rethink how the soundtrack of "Our World" imagined the future—and whose future it was.  	shae
33	October 1st	2026	Doug Turnbull	Professor of Computer Science at Cornell	a music and technology	Local Music is Important	There are talented musicians all around us. They play amazing live shows at small venues in every city all around the world. Yet music services like Spotify, Apple Music, YouTube, and TikTok do a poor job of helping listeners discover these artists for a variety of commercial, social, and technical reasons.  In this talk, we argue that supporting local music scenes is important and that we can use music recommender systems, such as <a href="https://localify.org">Localify.org</a>, to help promote local artists and live music events.	dtur
33	October 1st	2026	Jen de los Reyes & Oscar Rene Cornejo	Associate Professor of Art at Cornell, Assistant Professor of Art at Cornell	an art and environment	Learning from LAND: Art, Ecology, and Environmental Activism	Jen de los Reyes and Oscar Rene Cornejo will discuss their collaborative project LAND, which combines histories of artists' engagement with land-based practices and techniques with environmental regeneration and conservation to cultivate sustainable futures.	jend